,is_spam,url_pre
882,0,http www wsj com article debt soaring debt risk
883,0,http www morningbrew com daily story ford debut new f
884,0,http www cnbc com new ford f feature integrated generator air update html
885,0,http www detroitnews com story business auto ford ford series cash haul rank near iphone among u product
886,0,http www morningbrew com daily story bayer agrees billion settlement roundup lawsuit
887,0,http www flickr com photo jeepersmedia
889,0,http www flickr com people jeepersmedia
890,0,http www wsj com article bayer monsanto became one worst corporate dealsin chart
891,0,http www nytimes com business roundup settlement lawsuit html
892,0,http www morningbrew com daily story crossfit cut glassman good
893,0,http www cnn com business greg glassman selling crossfit index html
894,0,http www cnn com business greg glassman crossfit index html
895,0,http www nytimes com style greg glassman crossfit sexism html
896,0,http www morningbrew com daily story economic political consequence follow djokovics tennis tournament
897,0,http apnews com bd bc c bc e
898,0,http apnews com c ca bc b b e af cea e
899,0,http www nbcnews com news u news new york new jersey connecticut quarantine visitor coronavirus hot spot n
900,0,http www cnbc com apple store seven houston tx store closing due covid html
901,0,http www theguardian com u news jun texas coronavirus case infection houston hospital
902,0,http www reuters com article u gnc bankruptcy vitamin chain gnc file bankruptcy may close store sell id
903,0,http www cnn com tech olympus camera trnd index html
904,0,http go within co retail pulse
905,0,http www webull com activity
907,0,http www newyorker com magazine dont eat reading
908,0,http www goodreads com book show itchen onfidential
909,0,http www cnn com show anthony bourdain part unknown
910,0,http www travelchannel com show anthony bourdain
911,0,http firstwefeast com eat anthony bourdain standout recipe new cookbook
912,0,http qz com quartzy best way honor anthony bourdains memory eat like
915,0,http www history com news olympic marathon outlandish early history
927,0,http www cnbc com new york new jersey connecticut impose day quarantine traveler coronavirus hotspot state html
928,0,http www theverge com coronavirus daily record case covid u arizona texas trump
929,1,http coronavirus jhu edu testing individual state
930,0,http www texastribune org texas coronavirus greg abbott home
931,0,http www governing com hy ublic ealth fficials uitting uring andemic html
932,0,http www sciencedaily com release htm
933,0,http www ncbi nlm nih gov pmc article
934,0,http www reuters com article u michigan facial recognition u activist fault face recognition wrongful arrest first time id
935,0,http www nist gov news event news nist study evaluates effect race age sex face recognition software
936,0,http medium com oy uolamwini response racial gender bias amazon rekognition commercial ai system analyzing face eeced
937,0,http www wired com story algorithm predicts criminality based face spark furor
938,1,http www fool com ext content netflix really fear hbo
939,0,http www npr org section coronavirus live update new york city marathon canceled due coronavirus
940,0,http variety com digital news gone wind hbo max disclaimer horror slavery
941,0,http www bbc com news business
942,0,http www nature com article
943,0,http news northwestern edu story ligo virgo find mystery astronomical object mass gap
944,0,http www nature com article
945,0,http www reuters com article u usa stock wall street finish lower rising virus case weak economic view id
946,0,http www detroitnews com story business auto chrysler fiat chrysler get loan backed italy government
947,0,http fortune com gnc bankruptcy filing close store
948,0,http www ajc com news crime law cobb holmes speak ahmaud arbery case afternoon bp w tegn wg
949,0,http apnews com e aa b eabf f c
950,0,http www politico com news dc circuit order flynn judge dismiss charge
951,0,http www axios com bill barr testify house judiciary committee f c ae ec b e html
952,0,http thehill com homenews senate democrat block gop police reform bill amid senate stalemate
953,0,http www news com article news local arizona tucson custody death b f c e c e b de f
954,0,http www wnycstudios org podcasts radiolab article liberation rna
955,0,http www visualcapitalist com whats risk month view post covid world
956,0,http fivethirtyeight com feature look face mask according science
957,0,http abcnews go com nasa dc headquarters hidden figure mary jackson story
959,0,http www arcgis com apps ap ournal index html
960,0,http www bbc com news business
961,0,http www vox com highlight coronavirus covid wedding virtual wedding zoom quarantine
962,0,http www popsci com story technology inside air force b training mission
963,0,http www smithsonianmag com smart news beethoven black might wrong question ask
964,0,http www fastcompany com meet summer sleeper hit product bag pee
966,0,http www nytimes com opinion sunday trump cant disengage america world html
967,0,http worldview stratfor com article geopolitics united state part inevitable empire
968,0,http worldview stratfor com article geopolitics united state part inevitable empire
969,0,http www nytimes com interactive magazine slavery capitalism html
970,0,http www investopedia com article market economy country natural resource asp
971,0,http www newyorker com magazine hiroshima
973,0,http straight spam com
974,0,http www theringer com tv south park episode ranked
975,0,http digg com watch long range soccer goal rocket back net
979,0,http graphic reuters com oakveazawvr
980,0,http news trust org item q zfe
981,0,http nautil u issue energy bird fly mount everest
982,0,http onezero medium com inside social medium cult convinces young people give everything f fbec
983,0,http www messynessychic com arctic seaside town call paris north
984,0,http www politico com news angela merkel germany
985,0,http apimagesblog com blog plastic keep virus love away spain nursing home
986,0,http theconversation com uber wework airbnb coronavirus bursting tech bubble
987,0,http www bbc com future article quiet eye secret success athlete
988,0,http narratively com crime victim who obsessed true crime show
989,0,http www city journal org san francisco hotel motel plan homeless
990,0,http tedium co television test pattern history
991,0,http news gallup com poll confident protect self covid aspx
992,0,http www youtube com watch v j yhx u ref briefingday com curator briefingday com utm source briefingday com utm medium email
993,0,http gizmodo com endangered internet archive full treasure
994,0,http www thedodo com close home retiring detection dog surprised tennis ball
995,0,http thereader mitpress mit edu citizenship great extinguisher hope
996,0,http www outsideonline com sperm whale research dominica
997,0,http www esquire com entertainment music world history interview
998,0,http www theguardian com world jun live cage resident hide macaque gang take thai city
1000,0,http briefingday com n commentform
1004,0,http www theringer com tv south park oscar blame canada controversy
1005,0,http melmagazine com en u story girl gone wild commercial threw million millennials puberty
1006,1,http www youtube com playlist
1007,0,http www king com article news local seattle amazon rename keyarena climate pledge arena securing naming right e c b ee e cc
1008,0,http www youtube com watch v k u e ym h
1010,0,http apnews com ebaf dd dc e
1012,0,http www nbcnews com news u news texas governor pause state reopening due spike new covid n
1013,0,http apnews com b fed c bd e c
1014,0,http apnews com fa b f aed b b
1018,0,http www wired com story slack connect email stewart butterfield interview
1019,0,http www newyorker com culture video dept llama antibody could help fight coronavirus
1020,0,http www smithsonianmag com smart news uk museum reimagines masterpiece face mask
1021,0,http www washingtonpost com video game enjoy game make u work proficiency control fairness escape
1022,0,http www vice com en u article dz x uber acquisition jump bikeshare destroyed thousand bike
1023,0,http skratchbastid bandcamp com album dj mix starter era dope rap
1024,0,http old reddit com r sk eddit comment hep l stupidest thing youve done
1025,0,http www forecastapp net
1026,1,http www perininetworks com term condition
1027,1,http www imperica com en newsletter
1028,1,http www youtube com watch
1029,0,http www youtube com watch v q b
1030,0,http www youtube com watch v k sn
1031,0,http www youtube com watch v f ffdn
1032,0,http www youtube com watch v sv weo
1033,0,http lithub com someone wrong internet study pandemic distraction
1034,0,http therumpus net blacker berry quicker shoot
1035,0,http nplusonemag com online online kid could
1036,0,http mashable com article reddit history th anniversary
1037,0,http theface com music alternative black woman goth grunge emo rico nasty doja cat
1039,0,http www esquire com uk culture virtual pub quiz
1040,0,http www buzzfeednews com article adeonibada nigeriam comedian dont leave tiktok challenge
1041,0,http www vg com change name turok
1042,0,http www theatlantic com technology archive little pony nazi chan black life matter
1043,0,http tribunemag co uk conquest bread
1044,0,http www forbes com site carltonreid segway reach end road bicycle keep rolling c
1045,0,http www bellingcat com resource investigate tiktok like pro
1046,0,http www hollywoodreporter com news disney overhaul splash mountain ride outcry
1047,0,http www refinery com en u dixie chick name change racist root
1048,0,http www axios com golf pga tour fan lower score coronavirus fec cf fa cd html
1049,1,http theneed know u list manage com
1050,1,http theneed know u list manage com unsubscribe
1051,1,http theneed know u list manage com profile
1052,0,http www npr org patent racism
1053,0,http interactioninstitute org temporary autonomous zone
1054,0,http theweek com article seattle policefree autonomous zone anomaly
1055,0,http www utopiskehorisonter dk engelsk comcur htm
1056,0,http www cnn com travel article christiania copenhagen denmark index html
1057,0,http www newyorker com news dispatch attack exarchia anarchist refuge athens
1058,0,http www npr org surprising legacy occupy wall street
1059,0,http journal burningman org philosophical center tenprinciples black rock city taz rise great civilization
1060,0,http www king com article news local protest activist urge chop demonstrator leave capitol hill protest night chaz cc fe efb c e
1061,0,http www kuow org story chaz chop seattle protest make change
1063,0,http theanarchistlibrary org library hakim bey z temporary autonomous zone ontological anarchy poetic terrorism toc
1064,0,http en wikipedia org wiki eter amborn ilson
1065,0,http whatsupwithamsterdam com amsterdam squat
1066,0,http en wikipedia org wiki uburbia
1067,0,http theculturetrip com europe netherlands article brief history squatting amsterdam
1068,1,http framestrategy substack com
1069,0,http www framestrategy co
1070,1,http whyisthisinteresting substack com p interesting utopia
1071,1,http whyisthisinteresting substack com p interesting climate e
1072,0,http www bonappetit com story bittersweet quaratine cooking
1073,0,http www nytimes com opinion sunday poker bluffing luck skill html
1075,1,http app moonclerk com pay otanwlok
1076,0,http www nytimes com interactive art design rosie lee tompkins quilt html
1077,0,http hirshhorn si edu hirshhorninsideout
1082,0,http learntoexpress wixsite com learntoexpress
1083,0,http bringcamphome com
1084,0,http podcasts apple com u podcast mask girl summer id
1085,0,http revtownusa com offer skimm
1086,0,http www carawayhome com collection
1087,0,http www maryruthorganics com page skimm morning multi
1088,0,http magicspoon com product nut pack case box
1089,0,http vincerowatches com page skimm
1090,0,http www wearlively com collection bralette
1091,0,http get drinkhydrant com sample skimm lander
1092,0,http people com country dixie chick change name chick
1093,0,http www eonline com news elizabeth bank cast m frizzle magic school bus live action film
1094,0,http www cnn com medium splash mountain disney index html
1095,0,http www npr org section live update protest racial justice nasa name headquarters mary jackson first black female engineer text ashington headquarters statement released ednesday
1096,0,http www int news room detail new ebola outbreak detected northwest democratic republic congo surge team supporting response
1097,0,http abcnews go com nternational world nd deadliest ebola outbreak story
1098,0,http www nytimes com u supreme court obamacare appeal html
1099,0,http www reuters com article u usa trump obamacare trump administration asks supreme court axe obamacare id
1100,0,http www britannica com topic habeas corpus
1101,0,http thehill com regulation court battle supreme court permit fast track removal asylum seeker
1102,0,http www nytimes com business coronavirus small business loan large company html
1103,0,http www cnbc com trump say second round stimulus check could happen html
1104,0,http www cbsnews com news stimulus check dead people return irs
1105,0,http www nytimes com u politics coronavirus stimulus dead people html
1106,0,http www cnbc com texas gov abbott pause state reopening plan coronavirus case hospitalization rise html
1107,0,http www cbsnews com news texas coronavirus massive outbreak governor greg abbott reopening
1108,0,http www nytimes com interactive u state reopen map coronavirus html
1109,0,http www npr org section coronavirus live update texas governor hit pause reopening amid covid surge
1110,0,http www cnn com health maskne acne covid mask wellness index html
1114,0,http austinkleon com learn alone
1115,0,http www youtube com watch v jk r
1116,0,http www nytimes com art music bob dylan rough rowdy way html
1117,0,http www newyorker com culture culture desk bob dylan rough rowdy way hit hard
1118,0,http austinkleon com fish thought
1119,0,http explore org livecams brown bear brown bear salmon cam brook fall
1120,0,http offspring lifehacker com play game kid youre done parenting
1121,0,http www theguardian com tv radio jun netflixs floor lava show save summer
1122,0,http www amazon com ivers ides ndy oldsworthy dp ref li s tl
1123,0,http austinkleon com morning
1124,0,http austinkleon com change see
1125,0,http austinkleon com old welcoming new
1126,0,http www sfchronicle com bayarea article ire rancisco residio threaten php
1128,0,http www vulture com zadie smith new essay collection lockdown html
1129,0,http en wikipedia org wiki uihitsu
1130,1,http austinkleon com next day
1131,0,http h proof com product h proof
1132,0,http www vanityfair com news inside world poker super high roller
1133,1,http unsubscribe fourhourmail com xmu wqlokqf hxlr rao
1134,1,http go tim blog x output
1136,0,http en wikipedia org wiki uanxiu
1137,0,http www youtube com channel ei l c w jrv n w
1138,0,http open spotify com track tz b
1139,0,http www youtube com watch v q hy
1140,0,http hopkinspsychedelic org anorexia
1141,0,http tim blog psychedelics microdosing mind enhancing method
1142,0,http www youtube com watch v
1143,0,http tim blog largest psychedelic research center
1144,0,http tim blog enjoy perfect shower anywhere worldfor
1145,0,http tim blog tim ferriss show transcript caroline paul
1146,0,http tim blog caroline paul
1147,0,http en wikipedia org wiki im rien author
1148,1,http tim blog bullet friday
1149,1,http tim blog
1150,0,http digg cmail com u ptdjtuk vkjjhbly ik
1153,0,http datajournalism com read handbook verification
1154,0,http www doctornerdlove com finding hero monster detoxifying comic culture
1155,0,http longreads com long con britishness
1156,0,http guidetoallyship com
1157,0,http mildlyinteresting blog blogspot com
1158,0,http angeladeanestudio com
1159,0,http abw blue
1160,0,http www youtube com watch v
1161,0,http radiatoryang itch io hardlads
1162,0,http www stinkymeat net
1163,0,http www kickscondor com
1164,0,http dreamwiki sixey e welcome dream
1165,0,http www tiktok com fishesgetstitches
1166,0,http mowned com
1167,0,http www foldnfly com
1168,0,http trump shrunk com
1169,0,http www kickstarter com project ugmonk analog simplest productivity system
1170,0,http www theatlantic com photo eclipse
1171,0,http readtheplaque com
1172,0,http www glastonburyfestivals co uk line
1173,0,http www chiaraluzzana com
1174,0,http chrome google com webstore detail link text fragment pbcodcjpfjdpcineamnnmbkkmkdpajjg
1175,0,http www zooniverse org project hiro ono ai mar
1176,0,http www unhcr org goalclick
1177,0,http www epicgames com fortnite en partyroyale
1178,0,http unicornycopia com ezm
1179,0,http evolution depositphotos com
1181,0,http staykeen com landing
1182,0,http www theverge com luka artificial intelligence memorial roman mazurenko bot
1183,0,http www hereafter ai
1184,1,http waxy org
1185,0,http www katalog barbaraiweins com
1186,0,http airforcepuzzle com
1187,0,http fingeronthe app
1188,0,http aisnakeoil designinvestigations
1189,0,http www aquarium ru en
1190,0,http musiclab chromeexperiments com hared iano c
1191,0,http www mixcloud com jedhallam love save day three year anniversary special
1192,0,http doc google com presentation l fo wqxp v x pl k edit slide id g c e
1193,0,http www ofcom org uk data asset pdf file online nation report pdf
1194,0,http www tiktok com business en
1195,0,http www stophateforprofit org
1196,0,http fb com news context news article content
1198,0,http www adweek com digital facebook gaming creator design custom sticker emojis fan subscription player
1199,0,http www adweek com digital vidcon facebook tweak monetization option content creator
1200,0,http www adweek com digital facebook gaming level program live country
1201,0,http www adweek com digital facebook gaming debut live ad partnered gaming creator
1202,0,http npe fb com forecast community crowdsourced prediction collective insight
1203,0,http fb com news supporting black diverse community
1205,0,http www mixcloud com sadeagle sad eagle banging drum catch criminal
1206,0,http www behance net alicemoxlin
1207,1,http www imperica com en
1213,0,http www vox com donald trump lobster bailout obama
1214,0,http www vox com culture disney splash mountain redesign racist song south
1215,0,http www vox com donald trump poll coronavirus biden reelection losing
1216,0,http www vox com recode mark zuckerberg facebook chan zuckerberg initiative philanthropy tension
1217,0,http www vox com good college reopening fall coronavirus student faculty worry
1218,0,http open spotify com episode wm qw qv
1219,0,http www nytimes com opinion confederate monument racism html
1220,1,http www vox com free online crossword vox
1221,1,http www coronavirus gov
1222,0,http www vox com good outdoor dining drinking restaurant opening safety
1223,0,http www cnn com politics border wall th circuit appeal court index html
1224,0,http www nytimes com world africa ebola congo html
1225,0,http www npr org section coronavirus live update u set daily record new covid case
1226,0,http www vox com dc statehood vote filibuster supreme court joe biden
1227,0,http www washingtonian com six colossally stupid argument dc statehood
1228,0,http www npr org house vote friday would make c st state trump senate say
1229,0,http abcnews go com olitics house set vote dc statehood create washington douglas story
1231,0,http search itunes apple com eb bjects ontent ink woa wa link
1232,0,http www cnn com politics trump administration obamacare supreme court index html
1233,0,http www politico com news trump supreme court overturn obamacare
1234,0,http www axios com aca enrollment coronavirus b f ad cf c fd c html
1235,0,http www nytimes com u politics obamacare trump administration supreme court html
1236,0,http www vox com supreme court trump justice department health care obamacare affordable care act texas california
1238,0,http digg com edition top story
1239,0,http www thecut com anna delvey tricked new york html
1240,0,http www outsideonline com murder mountain bike
1241,0,http huckberry com store looft category p looftlighter x
1242,0,http www vox com police reform bill house democrat senate republican
1243,0,http www usatoday com story news politics supreme court upholds trump administration removing asylum seeker
1246,0,http digg com video bad relationship advice
1247,0,http www theatlantic com science archive second coronavirus surge
1248,0,http www nytimes com interactive u coronavirus spread html
1249,0,http www theringer com movie sight george clooney steven soderbergh
1250,0,http www insidehook com article politics edgy comedy lazy joe rogan coco diaz
1251,0,http www mentalfloss com article live aid concert history
1252,0,http digg com best meme trump walk shame one hand water drinking challenge
1253,1,http simplisafe com value
1255,1,http wtf u list manage com profile
1256,0,http americanart si edu
1257,0,http www glenstone org
1258,0,http www avclub com madonna golden girl queer icon lg
1259,0,http story californiasunday com eleanor davis hug look forward
1260,0,http www youtube com watch v ele
1262,0,http www npr org obamacare must fall trump administration tell supreme court
1263,0,http www caltech edu news black hole collision may exploded light
1264,0,http www nasa gov mission page chandra news black hole image make history
1265,0,http www ligo caltech edu page gw
1266,0,http www theguardian com science jun black hole may merge light trillion sun scientist say
1267,0,http apnews com ac bdd ac eed e b
1268,0,http tradingeconomics com united state asylum application
1269,0,http trac syr edu immigration report
1270,0,http www texastribune org asylum seeker experience texas mexico border
1271,0,http thehill com policy healthcare health insurance trump administration call supreme court strike
1272,0,http www noom com program health weight exsf
1273,0,http www nycpride org event nyc pride march
1274,0,http www espn com soccer fifa woman world cup story australianew zealand win bid host woman world cup
1275,0,http www billboard com article column country dixie chick change name
1276,0,http thehill com changing america enrichment art culture backlash racist trope disney splash
1277,0,http www nature com article
1278,0,http www broadinstitute org broad area focus project spotlight question answer crispr
1279,0,http newatlas com drone ai algorithm autonomous drone barrel roll flip
1280,0,http www bbc com news world africa
1281,0,http www cnn com medium lebron james springhill medium index html
1282,0,http www cnbc com german payment company wirecard file insolvency html
1283,0,http apnews com b ab fa f fe
1284,0,http www reuters com article u usa defense senate senate advance billion defense bill stage set confederate battle id
1285,0,http www politico com news senate pass china sanction bill
1286,0,http www politico com news police reform plan house
1287,0,http www axios com police reform george floyd protest b dd dc c fb c e html
1288,0,http apnews com e e c dfe e
1289,0,http www npr org section health shot year st patient get gene editing sickle cell disease thriving
1291,0,http www vox com unbundle defund police george floyd rayshard brook violence european policing
1292,0,http www manhattan institute org responds five idea sensible approach police reform
1294,0,http www usnewsdeserts com
1295,0,http startupgenome com article ranking top
1297,0,http www cbsnews com news eiffel tower reopens paris stair longest closure since wwii coronavirus
1298,0,http earther gizmodo com musician latest project made bat noise
1299,0,http goldenhearts co oldest golden retriever
1300,0,http www nbcnews com politics politics news dead wrong fed sent b stimulus check million n
1301,0,http ftw usatoday com nfl jay cutler instagram chicken
1302,0,http www history com day history u begin berlin airlift
1303,0,http en wikipedia org wiki abe idrikson aharias
1305,0,http www bbc com news story
1306,0,http www lawfareblog com law classified information primer
1307,0,http www vice com en u article akzkvp international fashion house leaving million asian jobless worker protesting
1308,0,http www wired co uk article door door salesperson coronavirus
1309,0,http www abc net au news odour history smelling magna carta shakespeare iliad
1310,0,http www reddit com r interestingasfuck comment hfwnua light captured trillion frame per second
1311,0,http www fastcompany com quibi quibi inside story jeffrey katzenbergs first dot com failure
1312,0,http aeon co essay time take alternative dark matter seriously
1313,0,http www aljazeera com programme peopleandpower coronavirus lockdown iran html
1314,0,http www devex com news data tell u state human right
1315,0,http expmag com health tracking implant create bionic cow human next
1316,0,http www youtube com watch v jjd r k ref briefingday com curator briefingday com utm source briefingday com utm medium email
1317,0,http www caltech edu news key memory based choice probed brain
1318,0,http www marketwatch com story lot bad news converging stock market here deal
1319,0,http nypost com al capone childhood home brooklyn hit market
1320,0,http qz com country expensive alcohol world
1322,0,http www outsideonline com tarahumara runner study
1323,0,http edition cnn com business pakistan fake pilot intl hnk index html
1324,0,http www theverge com nasa artemis astronaut human lunar lander toilet competition
1326,0,http briefingday com n commentform
1331,0,http www morningbrew com daily
1333,0,http www businessinsider com u weekly jobless claim filing unemployment insurance coronavirus recession economy
1334,0,http www morningbrew com daily story rising covid case threaten state reopening plan
1335,0,http www texastribune org texas elective surgery coronavirus greg abbott
1336,0,http www news jax com news local desantis plan move next phase reopening florida amid spike
1337,0,http nypost com here reopen new york phase four
