,is_spam,url_pre
1338,0,http www hollywoodreporter com news bellagio mgm resort la vega require guest wear face mask
1339,0,http www ajc com blog airport delta already banned passenger refusing wear mask f b h w v
1340,0,http www cnbc com apple close store florida rising covid rate html
1341,0,http www nbcnews com health health news cdc say covid case u may n
1343,0,http www morningbrew com daily story lebron james agent maverick carter raise million medium company
1345,0,http www morningbrew com daily story gao find stimulus check went dead american
1346,0,http www gao gov asset pdf
1347,0,http www morningbrew com daily story unilever change fair lovely skincare brand name
1348,0,http www bbc com news business
1349,0,http www wsj com article unilever rename fair lovely skin lightening cream amid criticism
1350,0,http www reuters com article u unilever whitening southasia unilevers fair lovely get makeover backlash id
1351,0,http www espn com nhl story id amazon backing seattle arena climate initiative
1352,0,http www cnbc com verizon pulling advertising facebook instagram html
1353,0,http www cnbc com nike nke report q earnings html
1354,0,http www reuters com article u wirecard account wirecard collapse owing creditor billion id
1356,1,http www nirandfar com focus quiz
1357,0,http www theverge com face mask glass fogging stop clear
1358,0,http www tiktok com btypep video
1359,0,http www tiktok com watercolorartist video
1360,0,http www tiktok com evanatoredits
1361,0,http www tiktok com kcdadventure
1362,0,http www tiktok com discovery video
1363,0,http www tiktok com washingtonpost video
1364,0,http www tiktok com nfl video
1365,0,http www morningbrew com daily story finance twitter account follow
1368,0,http puzzle blainesville com npr sunday puzzle dec digit html
1378,0,http mailchi mp creativemornings weekly highlight
1379,0,http ownyourcontent wordpress com toolkit write page
1380,0,http ownyourcontent wordpress com paul jarvis
1381,0,http wordpress com go business website guidance create page website
1382,0,http holleymurchison com tmay book
1383,1,http wordpress com creativemornings
1384,1,http ownyourcontent wordpress com
1385,1,http hey com
1386,1,http airtable com shrfzkyygv hrb
1387,0,http psyche co guide engage life feel
1388,0,http www designbetter co podcast nancy douyon
1389,0,http www quakelab ca blog please dont check black employee
1390,0,http wordpress com go content blogging blogger block writing resource try youre idea
1391,0,http collageretreat wtf
1392,0,http latinxdesigndirectory com
1393,0,http www natashaknows com summersoulstice
1394,0,http gleefactor com resource
1395,0,http www adalo com future code conclusion
1396,0,http www oprahmag com entertainment book black queer author
1397,0,http www wingspan app blog start resent one client
1398,0,http www youtube com c nalog ournal playlist
1399,0,http www twitch tv soulection video
1400,0,http giphy com salim adam
1401,0,http www timcasasola com blog design
1402,0,http www quakelab ca
1403,0,http www natashaknows com
1404,1,http creativemornings com company
1405,0,http creativemornings com company studio cooke john
1406,0,http creativemornings com company west th design studio
1407,1,http creativemornings com job
1408,1,http creativemornings com company black sheep agency
1409,1,http creativemornings com company shopify
1410,0,http creativemornings com company place staffing
1411,0,http creativemornings com company numarket
1412,0,http creativemornings com company sdco partner
1413,1,http creativemornings com individual emerlineji
1414,1,http creativemornings u list manage com profile
1415,1,http creativemornings u list manage com unsubscribe
1416,1,http www creativemornings com
1417,0,http mymodernmet com baby owl sleeping
1418,0,http apnews com cc dbb dfa c b c
1419,0,http www theringer com breonna taylor louisville police black life matter protest
1420,1,http wtf u list manage com unsubscribe
1421,1,http open spotify com playlist rryt qt dd xp
1422,0,http www nytimes com interactive magazine america slavery html
1423,0,http nikolehannahjones com
1425,0,http bombas com pride sc loremipsum
1426,0,http dnd wizard com article feature diversity dnd
1427,0,http pb twimg com medium f jpg
1428,0,http www pawpatrol com
1429,0,http www vulture com cop live pd legacy running cop html
1430,0,http www nytimes com art television protest fictional cop html
1431,0,http www theatlantic com health archive story black band aid
1432,0,http www forbes com site lisettevoytko uncle ben brand evolve following aunt jemimas removal e c
1433,0,http en wikipedia org wiki astus text astus pejorative term considered offensive
1434,0,http www forbes com site jemimamcevoy cream wheat becomes fourth brand hour revisit packaging racist origin ac
1435,0,http www conagrabrands com news room news conagra brand announces mr butterworths brand review prn
1436,0,http www nbcnews com pop culture pop culture news relative aunt jemima actress express concern history erased n
1437,0,http www wsj com article pepsico unit retire aunt jemima brand citing origin racist stereotype
1438,0,http www forbes com site jemimamcevoy cream wheat becomes fourth brand hour revisit packaging racist origin b ac
1439,0,http kareemali bandcamp com
1440,0,http kareemali bandcamp com album black power
1441,0,http kareemali bandcamp com album black advancement
1442,0,http kareemali bandcamp com album black freedom
1443,0,http www youtube com watch v f dj l
1446,0,http action justiceforbreonna org sign reonna ssential
1447,1,http www nytimes com interactive u coronavirus u case html
1448,1,http www eventbrite com e big friendship book launch ticket
1449,0,http pagesofhackney co uk
1450,1,http www sixthandi org event ann friedman aminatou sow
1451,0,http www politics prose com
1452,1,http www bigfriendship com event
1453,1,http blog u list manage com subscribe
1454,0,http www anchorandorbit com grow biz
1455,0,http www feelingmyflo com
1456,0,http www tightlippedpod com
1457,0,http witchesconfluence org newsletter
1458,0,http www entropyinherited com
1459,1,http wixsite u list manage com subscribe
1460,1,http www theokraproject com
1461,1,http www annfriedman com classified
1462,1,http www annfriedman com weekly
1463,1,http app moonclerk com portal oyynk uo signin
1464,0,http www theguardian com commentisfree jun arctic heatwave c siberia science
1465,0,http www theatlantic com idea archive second great depression
1466,0,http www wired com story airbnb quietly fired hundred contract worker im one
1467,0,http saltyworld net fat chick walk doctor office
1468,0,http www thecut com daughter always loved solitude much html
1469,0,http www marieclaire com politics prison release recidivism
1470,0,http austinkleon com free cheap
1471,1,http austinkleon com book
1472,1,http austinkleon com newsletter
1473,1,http austinkleon com keepgoing
1474,1,http austinkleon com
1475,1,http austinkleon com
1476,1,http austinkleon com steal
1477,1,http austinkleon com contact
1478,1,http austinkleon u list manage com profile
1479,1,http austinkleon u list manage com unsubscribe
1480,1,http www indiebound org indie bookstore finder
1482,0,http cheddar com newsletter eb share
1483,1,http u forward friend com forward
1484,1,http cheddar com live
1486,0,http www nytimes com u coronavirus case young people html
1487,0,http www reuters com article u facebook ad boycott verizon verizon suspends advertising facebook join growing boycott id
1488,0,http www sportingnews com u nascar news bubba wallace noose picture lamurgkgs gc xtyv h tq
1490,1,http podcasts apple com u podcast cheddar need know id
1491,1,http open spotify com show hx ofzr
1492,0,http www gq com story chase strangio aclu lgbtq legal victory
1493,0,http tinyletter com dayo letter two noun labyrinth
1494,0,http www theguardian com commentisfree jun abolish police sexual assault violence
1495,0,http www newyorker com news news desk domestic abuser keep accountable one watching
1496,0,http www nytimes com u minneapolis george floyd police html
1497,0,http www latimes com opinion story social medium trauma black killing
1498,0,http www theguardian com society jun online harassment increase american minority group
1499,0,http news artnet com opinion limit care knowledge yesomi umolu op ed
1500,0,http www runnersworld com runner story ahmaud arbery death running racism
1501,0,http www vox com identity police black trans people violence
1502,0,http www thecut com day since breonna taylor murder html
1503,0,http www newyorker com news dispatch vanishing monument columbus ohio
1504,0,http www newyorker com magazine trayvon generation
1505,0,http www independentpublisher com article php
1506,0,http tinyletter com dayo
1507,1,http www bigfriendship com
1508,0,http www callyourgirlfriend com episode origin story summer friendship
1509,0,http mailchi mp ladyswagger close frond
1510,0,http giveessential org
1511,1,http www annfriedman com aboutme
1512,1,http www annfriedman com writing
1513,1,http www annfriedman com speaking
1514,1,http www annfriedman com consulting
1515,1,http annfriedman u list manage com profile
1516,1,http annfriedman u list manage com unsubscribe
1517,0,http mailchi mp bigspaceship big spaceship internet brunch
1518,0,http www youtube com watch v r g utm source nternet runch utm campaign b c utm medium email utm term fb e aa b c mc cid b c mc eid
1519,0,http www youtube com watch v da utm source nternet runch utm campaign b c utm medium email utm term fb e aa b c mc cid b c mc eid
1521,0,http ew com tv conversation friend adaptation hulu sally rooney
1522,0,http variety com film box office tenet release date delayed christopher nolan
1523,0,http www eonline com news justin bieber file million defamation lawsuit sexual assault accuser
1524,0,http www youtube com watch v z hu feature youtu utm source nternet runch utm campaign b c utm medium email utm term fb e aa b c mc cid b c mc eid
1525,0,http www cnbc com ford unveils new f tech savvy pickup hand free driving html
1526,0,http www theverge com microsoft retail store closing city open
1527,0,http www nytimes com business kanye west yeezy gap html
1528,0,http www economist com leader next olympics include fortnite
1529,0,http www cbsnews com news bubba wallace nascar noose photo garage
1533,0,http austinkleon com good thing must begin
1534,0,http mailchi mp austinkleon good thing must begin
1537,0,http www menshealth com fitness yoga men
1542,0,http www fastcompany com decontaminate n mask minute
1543,0,http www youtube com watch v ngf k ref briefingday com curator briefingday com utm source briefingday com utm medium email
1545,0,http www biography com news stephen hawking zinger
1546,0,http www noemamag com anthropocene microbiocene
1547,0,http easterneuropeanmovies com
1548,0,http www curbed com swimming pool ground coronavirus
1549,0,http designyoutrust com breathtaking aerial shot barcelona revealing city symmetry
1550,0,http www bbc com reel video p hfhck little known concept hypersanity
1551,0,http www outsideonline com grid cabin life california
1552,0,http www treehugger com slowest animal world
1553,0,http www bbc com future article astonishing focus namibia nomad
1554,0,http www todayifoundout com index php coming america life frederick trump
1555,0,http www apollo magazine com future museum fundraising
1556,0,http www stevebenjamins com blog music age algorithm syg
1557,0,http www theguardian com environment jun cyanide bomb wildfire service idaho
1558,0,http www bbc com news blog trending
1559,0,http www typeinvestigations org investigation exporting virus
1560,0,http www haaretz com world news premium million people jailed china gulag escaped go inside
1561,0,http www wired co uk article mask shaming
1562,0,http theconversation com northern ireland police transformation may hold lesson u
1563,0,http briefingday com n commentform
1565,1,http www morningbrew com account q yy f g yvy id edit
1570,0,http www morningbrew com daily story youre getting married pandemic html
1573,0,http www boston com news local news rhode island town declared first amendment sanctuary
1574,0,http medium giphy com medium j g dvsgta giphy gif
1575,0,http www cnn com u guy fieri flavortown columbus ohio petition trnd index html
1576,0,http www morningbrew com daily story future city utm source morning brew
1577,0,http www physic harvard edu undergrad humor
1578,0,http existentialcomics com comic
1579,0,http www youtube com watch v z r utm source morning brew
1580,0,http www youtube com watch v b sv rc g utm source morning brew
1581,0,http theconversation com trolley dilemma would kill one person save five
1582,0,http podcasts apple com u podcast climate data revolution id
1583,0,http www cnn com investing luckin coffee delisted index html
1584,0,http www cnbc com nike ceo john donahoe tell employee layoff coming html
1585,0,http www cnn com tech microsoft store closing index html
1587,0,http www reuters com article u l oreal whitening loreal drop word whitening skin product id
1588,0,http www cbssports com soccer news fifa woman world cup australia new zealand joint bid awarded hosting duty next
1589,0,http www bbc com news uk england merseyside
1590,0,http www morningbrew com daily story nwsl return utah monthlong tournament
1591,0,http www cnbc com amazon spending billion zoox invest billion html
1592,0,http www wsj com article elon musk call amazon breakup latest spat jeff bezos
1593,0,http www cnbc com amazon buy self driving technology company zoox html
1594,0,http www morningbrew com daily story amazon level autonomous driving game
1595,0,http www youtube com watch v zyg x c
1596,0,http www complex com style kanye west tap mowalola ogunlesi design director yeezy gap
1597,0,http www morningbrew com retail story simon sue gap inc missed rent payment
1598,0,http www cnbc com gap gps report q net loss share fall html
1599,0,http www youtube com watch v b utm source morning brew
1600,0,http www morningbrew com daily story kanye gap team new clothing line
1601,0,http www wsj com article coronavirus latest news
1602,0,http www cnn com health florida coronavirus case young people index html
1603,0,http www axios com florida single day increase coronavirus case b c e eb html
1604,0,http www nbcnews com news u news texas close bar limit restaurant dining due explosion covid n
1605,0,http www morningbrew com daily story texas florida put curb bar stem outbreak among young people
1606,0,http www cnbc com zuckerberg facebook prohibit hate speech ad html
1607,0,http gizmodo com stop hate profit movement isnt going stop
1608,0,http www forbes com site martyswant civil right group ask marketer boycott facebook outdoor brand pause spending f c
1609,0,http www cnbc com coca cola pause advertising social medium platform globally html
1610,0,http www ft com content e fa ba e ab
1611,0,http www morningbrew com daily story facebook boycott grows zuck announces new policy change
1612,0,http www nytimes com world europe europe u travel ban html
1613,0,http www cnbc com stock market future open close news html
1614,0,http www reuters com article u usa economy spending u consumer spending rebound falling income surging covid case loom id
1618,0,http www morningbrew com daily
1620,0,http digg cmail com u ptddylt vkjjhbly ih
1624,0,http digg com edition top story
1625,0,http splinternews com first step recovery admitting youre racist
1626,0,http magazine atavist com ghost pickering trail
1627,0,http classic avantlink com click php
1628,0,http digg com video someone mashed anti mask protester florida park recreation town hall meeting
1629,0,http www hollywoodreporter com news streamer muzzling controversial doc
1630,0,http www buzzfeednews com article scaachikoul day netflix michele morrone sex erotica
1632,0,http www vox com culture best movie far streaming
1633,0,http digg com best photo week forgotten playground
1634,0,http newrepublic com article justice department fake fight sex trafficking
1635,0,http digg com oldest restaurant world visualized
1636,0,http www theatlantic com politics archive kamala harris shadow campaign vice president
1637,0,http www lelo com pride month
1639,0,http www spiegel de international business corona slaughterhouse high price cheap meat ad df c c f df fdc c bd
1640,0,http briefingday com n
1642,0,http www youtube com watch v tgb ym vq feature youtu
1643,0,http www youtube com watch v ozw te feature youtu
1644,0,http www youtube com watch v g wr feature youtu
1645,0,http www youtube com watch v e dan f feature youtu
1646,0,http vincerowatches com page elevator
1647,0,http www youtube com watch v og u feature youtu
1648,0,http mailchi mp b c e eaf benedict newsletter
1649,1,http ben evans u list manage com unsubscribe
1650,0,http u forward friend com forward
1651,0,http www ofcom org uk research data internet demand research online nation narrative
1652,0,http mobiledevmemo com apocalypse per wwdc idfa dead
1653,0,http medium learningbyshipping com apple relentless strategy execution aa
1654,0,http digitstodollars com apple silicon rest u
1655,0,http www nytimes com technology facial recognition arrest html
1656,0,http www jdsupra com legalnews california privacy right
1657,0,http ec europa eu info site info file codeofconduct factsheet pdf
1658,0,http www cam ac uk story digitalmycenae
1659,0,http www readingdesign org ten thing
1660,0,http secondbreakfast co google blew ten year lead
1661,0,http www protocol com mike schroepfer facebook interview
1662,0,http www opensignal com rakutens mobile experience set challenge japan world
1663,0,http blog google product admanager news publisher make money ad manager
1664,0,http blog google product admanager display buying share revenue publisher
1665,0,http www ft com content aff e fb adfbc bbd
1666,0,http digg com video crime expert critique movie realistic money laundering scene
1667,0,http digg com video make trader joes product
1668,0,http digg com wing movie tracking shot incredible
1669,0,http store digg com sale waterproof bug zapper lantern gray
1670,0,http digg com edition top video
1674,0,http digg cmail com u ptddjn vkjjhbly tl
1675,0,http blog google technology safety security keeping private information private
1676,0,http www thetileapp com en gb work
1677,0,http developer apple com find
1678,0,http news microsoft com microsoft store announces new approach retail
1681,0,http digg com video dirty flushing house listing
1682,0,http digg com video trey kennedy karen impression
1683,0,http digg com video squirrel show woman peanut stash
1684,0,http digg com video would happen injected liquid metal inside stretch armstrong action figure
1685,0,http www eater com reopening restaurant struggling rehire employment coronavirus pandemic covid
1689,0,http briefingday com n commentform
1691,0,http seth blog stolen address book
1692,0,http www reuters com article u boeing max exclusive exclusive boeing max certification flight test begin monday source id
1693,0,http www city journal org plummeting confidence expert
1694,0,http techcrunch com tim oreilly make persuasive case venture capital starting harm good
1695,0,http www thedodo com video daily dodo baby animal pure joy
1696,0,http boingboing net magnetic medium enthusiast html
1697,0,http www itsnicethat com article barbara iweins katalog photography
1698,0,http futurism com byte michigan illegal company microchip employee
1699,0,http www bbc com worklife article canada forgotten universal basic income experiment
1700,0,http www vintage everyday com curtis wright air car html
1701,0,http www foodandwine com travel restaurant scamming pizza hut
1702,0,http mysteriousuniverse org forbidden hotel room haunted guest arent allowed stay
1703,0,http theconversation com holding holding still son photograph father alzheimers
1704,0,http www marketwatch com story reason stock market may face severe bout turbulence next week beyondonly one rising coronavirus case
1705,0,http news gallup com poll ideal evening american involve family time aspx
1706,0,http theweek com article dark day inside cinema business
1708,0,http aeon co essay child earliest memory go
1709,0,http www profgalloway com higher ed enough already
1710,0,http www reuters com article u facebook ad breakingviews breakingviews corporate boycott expose inconvenient truth id
1711,0,http phys org news conspiracy theory emergeand storyline fall html
1712,1,http www ben evans com newsletter
1713,0,http www ben evans com benedictevans zoom next video
1714,0,http www cnbc com facebook ad boycott entered big league html
1716,0,http blog aboutamazon com company news acquiring zoox help bring vision autonomous ride hailing reality
1717,0,http ec europa eu commission commissioner vestager announcement competition digital age changing enforcement changing time en
1718,0,http www businesswire com news home en
1719,0,http www theverge com starbucks advertising social medium july facebook twitter
1720,0,http apnews com b f c fe
1721,0,http www nytimes com business medium acebook advertising boycott html
1723,0,http thehustle co tarbucks ad
1724,0,http www cnn com tech white supremacist telegram racism intl index html
1725,0,http techcrunch com telegram pay sec fine million return billion investor dissolve ton
1726,0,http thehustle co elegram messaging app
1727,0,http www reuters com article u health coronavirus cattle feature gun travel coronavirus meat plant build demand mobile butcher id
1728,0,http thehustle co butcher
1729,1,http trend co weekly lecture exclusive offer
1730,0,http thekanyestory com
1731,0,http marketingexamples com
1732,0,http www reuters com article u facebook ad boycott exclusive exclusive facebook ad boycott campaign go global organizer say id
1733,0,http gizmodo com twitter sorry putting covid misinformation labe
1734,0,http www newyorker com news letter silicon valley ghost kitchen future
1735,0,http www theverge com fake app twitter tiktok meme
1736,0,http www forbes com site tamarathiessen covid birthplace wuhan china top travel attraction efce e
1737,0,http www nytimes com realestate could doomsday bunker become new normal html
1738,0,http www chicagobusiness com airline airport american air pilot fed buy seat
1739,0,http www nytimes com style tiktok teen politics gen z html
1740,0,http www quantamagazine org new geometric perspective crack old problem rectangle
1741,0,http www nytimes com money philanthropy pandemic coronavirus html
1742,0,http www qmunity tech qubes camp
1743,0,http woven com
1745,0,http www vettery com
1746,1,http thehustle co
1747,1,http thehustle co account
1748,1,http doc google com form k rx f x tz jb cq viewform
1749,1,http doc google com form pf txf gl z m n ne sgxkvx viewform
1750,1,http doc google com form q g rr xdb dy g tv omw iuxw viewform
1751,1,http thehustle co first million podcast
1752,1,http thehustle co career
1753,1,http thehustle co advertise
1754,1,http www youtube com channel ya mg u jy ik aug
1755,1,http trend co
1756,1,http thehustle co daily
1757,0,http cheddar com newsletter ae share
1759,0,http www texastribune org mike penny visit dallas texas grapple coronavirus spike
1760,0,http www nme com news music bet award full winner list roddy ricch lizzo
1761,0,http www sciencedaily com release htm
1762,0,http phys org news theorist upper limit quantization html
1763,0,http healthsciences ku dk newsfaculty news sledge dog closely related year old ancient dog
1764,0,http cheddar com medium stock sink coronavirus case jump
1765,0,http www reuters com article u albertsons company ipo albertsons share fall nyse debut id
1767,0,http market businessinsider com news stock gap stock surge year apparel deal kanye west yeezy
1768,0,http www cnbc com chesapeake energy pioneer u shale revolution file bankruptcy protection html
1769,0,http www courier journal com story news local know louisville shooting breonna taylor protest
1770,0,http thehill com homenews administration trump praise video includes protester shouting white power
1771,0,http www theguardian com u news jun russia offered bounty afghanistan militant killing u soldier report outrage
1772,0,http www nbcnews com news u news saharan dust cloud set hit southern state u reducing n
1773,0,http www usatoday com story news nation sahara dust cloud storm reach u mainland
1774,0,http www npr org parent learn child care center stayed open lockdown
1777,0,http en wikipedia org wiki lobe heatre hakespeare lobe heatres
1778,0,http www vice com en u article xg gwz invading cicada may turn sex crazed zombie summer
1779,0,http www latimes com entertainment art music story song summer beyonce drake lil baby
1780,0,http www npr org beyonc drop visual album black king disney july
1781,0,http www youtube com watch v l u feature emb title
1782,0,http arstechnica com gaming doomscrolling slowly eroding mental health
1783,0,http www yelpeconomicaverage com yelp coronavirus economic impact report html
1785,0,http www nytimes com travel dolomite italy hut hiking html
1786,0,http theconversation com simple model show importance wearing mask social distancing
1787,0,http bitchesgottaeat substack com
1788,0,http minimizer substack com welcome
1789,0,http theankler com
1790,0,http www publishersweekly com
1791,0,http lithub com
1792,0,http skift com
1793,0,http www remodelista com
1794,0,http elanaspantry com
1795,0,http nomnompaleo com
1796,0,http food com
1797,0,http www milkstreet com
1798,0,http www vulture com author priyanka mattoo
1799,0,http www primattoo com
1800,0,http podcasts apple com u podcast foxy brown id
1801,0,http www earios net
1805,0,http www camellaskitchen com shop
1806,0,http justiceinjune org
1807,0,http prose com
1808,1,http www sakara com page skimm
1809,1,http www summersalt com page summersalt skimm
1811,0,http www nytimes com u politics russian bounty warning trump html
1812,0,http abc ny com shot hour nyc shooting new york city brooklyn shooting
1813,0,http www csmonitor com ociety hy ississippi lawmaker voted retire onfederate flag
