,is_spam,url_pre
0,1,http briefingday u list manage com unsubscribe
1,1,http www hvper com
2,1,http briefingday com v n f
3,0,http briefingday com n commentform
4,1,http briefingday com fan
5,0,http www brookings edu interactives reopening america world
6,0,http www reuters com investigates special report health coronavirus britain pub
7,0,http www theatlantic com magazine archive supermarket miracle
8,0,http www vox com john bolton book excerpt trump ukraine china
9,0,http www theguardian com travel jun end tourism coronavirus pandemic travel industry
10,0,http www bbc com future article virus disappeared
11,0,http narratively com quarantined hippy trapped jungle paradise
12,0,http ourworldindata org grapher daily covid case day average
13,0,http www spiked online com healthy society destroy monument
14,0,http www nytimes com interactive business economy container ship built html
15,0,http aeon co essay nostalgia rocket fuel power hope change
16,0,http www youtube com watch v k cu yz ref briefingday com curator briefingday com utm source briefingday com utm medium email
17,0,http www popsci com story science haribo gummy candy flavor
18,0,http www atlasobscura com article coffee
19,0,http www outsideonline com john ackerman cave minnesota
20,0,http nautil u issue energy power crossed brain wire
21,0,http www scmp com abacus tech article satellite internet failed year ago time different
22,0,http www technologyreview com innovator
23,0,http www marketwatch com story best worst stock first day coronavirus pandemic
24,0,http josefschulz com uebergang
25,0,http www sadanduseless com bread doggos
26,0,http nmaahc si edu explore collection
27,0,http www theguardian com u news jun call grow make juneteenth federal u holiday
28,0,http nmaahc si edu blog post historical legacy juneteenth
29,1,http join com
30,1,http link morningbrew com manage z oc
31,0,http www morningbrew com daily latest
32,0,http help aweber com hc en u article
33,1,http austinkleon u list manage com subscribe confirm
34,0,http www nytimes com upshot epidemiologist decision child school coronavirus html
35,0,http findthatpod com archive
36,0,http www constantpodcast com episode cold hard truth pt
37,0,http www theobservereffect org marc html
38,0,http www wired com story covid bad may big one
39,0,http www expressnews com news local article hour inside php
40,0,http www politico com news klobuchar biden woman color
41,0,http museeholocauste ca en object identification badge political prisoner nazi camp
42,0,http techcrunch com facebook trump campaign nazi imagery red triangle
43,0,http www nbcnews com politics election trump supporter crowd tulsa ahead saturday rally n
44,1,http ourworldindata org grapher daily covid death day average
45,0,http www axios com california face mask order coronavirus e bea f ab html
46,0,http www reuters com article u albertsons company ipo u grocer albertsons expects ipo raise billion id
47,0,http www reuters com article u palantir funding japanese insurer sompo investing million data analytics firm palantir id
48,0,http techcrunch com ipo delay doordash confirms raise
49,0,http nypost com carnival loses billion coronavirus sink cruise industry
50,0,http www hopkinsmedicine org news newsroom news release light activated crispr trigger precision gene editing super fast dna repair
51,0,http www caltech edu news natural fluid injection triggered cahuilla earthquake swarm
52,0,http www theguardian com environment jun climate change air pollution investigation study
53,0,http www theguardian com environment jun climate crisis alarm record breaking heatwave siberia
54,0,http techcrunch com colin kaepernick join medium board director ink partnership publishing deal
55,0,http www bbc com news entertainment art
56,0,http www hollywoodreporter com news amc theatre reopen u location july
57,0,http www supremecourt gov opinion pdf ifl pdf
58,0,http www reuters com article u usa trump immigration dreamer factbo factbox immigrant dreamer affected u supreme court ruling id
59,0,http www scotusblog com opinion analysis court reject trump administration effort end daca
63,0,http briefingday com n commentform
65,0,http www ianwelsh net cruelty required
66,0,http www forbes com site sergeiklebnikov goldman see clear sign recovery say risk remain
67,0,http www theguardian com film jun werner herzog im fascinated trash tv poet must avert eye
68,0,http arstechnica com science trump administration paid million test tube got unusable mini soda bottle
69,0,http www youtube com watch v ref briefingday com curator briefingday com utm source briefingday com utm medium email
70,0,http www mansionglobal com article apartment next door london famed royal albert hall asks million
71,0,http www visualcapitalist com growth covid united state peak
72,0,http www statista com chart country hosting refugee
73,0,http howmuch net article gold silver ratio timeline
74,0,http www youtube com watch v wy r ik ref briefingday com curator briefingday com utm source briefingday com utm medium email
75,0,http www saturdayeveningpost com heinrich beranns map beauty
76,0,http news trust org item w ypw
77,0,http www devex com news opinion open response open recovery
78,0,http www lesswrong com post n v sb zpk cognitive algorithm
79,0,http seth blog dominant culture
80,0,http www cnet com news dark matter detector pick unexplained unexpected signal
81,0,http www protocol com bret arensault microsoft ciso profile
82,0,http www sciencemag org news worst year alive
83,0,http themarkup org banned bounty amazon enforcement failure leave open back door
84,0,http theneutral com company rush change brand name image based racial stereotype
85,0,http www wired co uk article coronavirus beijing second wave lockdown
86,0,http www lawfareblog com question government bolton book tro hearing
87,1,http doc google com form e p ew gt k e x rsg g rm lr yduq w viewform
88,0,http www cbsnews com news space tourism space perspective balloon ride earth atmosphere
89,0,http www youtube com watch v n z h
90,0,http iflscience com plant animal giant squid found washed beach south africa
91,0,http www cbsnews com news watch weekend rare solstice ring fire solar eclipse
92,0,http www thebalance com unemployment
93,0,http www cnbc com rob portman congress need creative solution jobless benefit html
94,0,http www cnbc com weekly jobless claim html
95,0,http mymodernmet com santiago olay milky way cargo ship
96,1,http stackmedia io
97,0,http www sandiegouniontribune com business story zoo baby pygmy hippo make splash debut
98,0,http seattle eater com seattle protest zone chop chaz capitol hill food eating
99,1,http doc google com form e p c uj w u q vwjiha viewform
100,1,http www businesscasual fm
101,1,http www morningbrew com emerging tech
102,1,http www morningbrew com retail
103,0,http www youtube com watch v k feature youtu ref briefingday com curator briefingday com utm source briefingday com utm medium email
104,0,http www cnbc com stock market future open close news html
105,0,http apnews com ecbdd c b ed f c b b
106,0,http www manscaped com product weed whacker
107,1,http www morningbrew com daily story covid consumer
108,0,http www morningbrew com daily
109,1,http www morningbrew com
110,0,http bgr com alcoholic monkey india kalua
111,0,http www reuters com article u pepsico race breakingviews breakingviews cox company go first reparation id
112,0,http www mentalfloss com article got spare keanu reef call charity
114,0,http briefingday com n commentform
118,0,http www cbsnews com news amc movie theater face mask policy required
119,0,http www cnn com tech wirecard fraud tech accounting
120,0,http www forbes com site bradhunter three reason home improvement fastest growing retail category watch e b
121,0,http www reuters com article u health coronavirus garden home gardening bloom around world coronavirus lockdown id
122,0,http www vox com good summer pool open inflatable boat rental camp lawn coronavirus
123,0,http www morningbrew com daily story lowes beat home depot sale surge html
124,0,http www federalreserve gov publication economic well u household banking credit htm
125,0,http www forbes com site jonmarkman pandemic ring death knell paper cash ae
126,0,http www ft com content e e e c bb c
127,0,http www cnbc com coroanvirus bain report global luxury sale beyond html
128,0,http www theatlantic com technology archive youll shop grocery pandemic
129,0,http www forbes com site jenniferwang instacart founder apoorva mehta becomes billionaire e
130,1,http www bloomberg com tosv html
131,0,http opportunityinsights org wp content uploads tracker summary pdf
132,0,http www cnbc com u saving rate hit record percent coronavirus cause american stockpile cash curb spending html
133,0,http www thesunmagazine org issue boyfriend girlfriend
134,0,http news trust org item e oq
135,0,http tedium co flight entertainment system covid impact history
136,0,http www profgalloway com iaddiction
137,0,http www bbc com future article boeing plane shrank world
138,0,http sivers org exan
139,0,http www dw com en german police allowed use gun
140,0,http www psychologytoday com u blog insight therapy good king social status health
141,0,http www buzzfeednews com article tanyachen influencers privilege post black square
142,0,http fivethirtyeight com feature economy mess isnt stock market
143,0,http www realclearpolitics com article medium begging second wave html
144,0,http www ft com content eae cc f
145,0,http www smithsonianmag com innovation covid tipping point telemedicine
146,0,http www theguardian com commentisfree jun venice tourism covid coronavirus green tourism
147,1,http www morningbrew com privacy
149,1,http shop morningbrew com
150,1,http job lever co morningbrew
151,1,http www morningbrew com essential
152,1,http www morningbrew com daily r
153,1,http www morningbrew com daily r
154,1,http www morningbrew com daily refer friend
155,0,http medium giphy com medium giphy gif
156,0,http www standard co uk business cashstrapped british airway sell artwork worth million html
157,0,http morningbrewdaily typeform com txd g
158,0,http patch com new york westhampton hamptonbays filmmaker got movie america pandemic
159,0,http neeva co
161,0,http invest truststamp ai morningbrew
162,0,http www cnbc com robinhood increase guardrail option trading wake customer suicide html
163,0,http www cnbc com apple close store covid case reappear html
164,0,http www amusingplanet com liverpool secret tunnel built html
165,0,http reason com swiss cop investigate year old boy trying use toy money
166,0,http melmagazine com en u story summer signaled end arnold dawn cgi
167,0,http www mentalfloss com article incisive fact jaw
168,0,http www independent co uk life style cinema return lockdown closed watch movie silence html
169,0,http www afar com magazine rugby north dakota geographical center north america
170,0,http www cbsnews com news arctic hottest temperature ever
171,0,http www lesswrong com post hxvf iq oqyr wireless trap
172,0,http www thecut com think arnold schwarzeneggers mini horse lot html
173,0,http www psychologytoday com u blog beauty sick instagram worse body image facebook
174,0,http medium learningbyshipping com app store debate story ecosystem eeef
175,0,http www npr org money tracker much trump biden raised election
176,1,http austinkleon com good book read spring
177,0,http www youtube com watch v tp tgyx ref briefingday com curator briefingday com utm source briefingday com utm medium email
178,0,http aeon co essay reality computer simulation matter
179,0,http www fastcompany com airbnbwhileblack inside story airbnbs racism problem
180,0,http undark org undark interview brianna remster
181,0,http www bbc com news business
183,0,http nypost com inside u government plan blow moon
184,0,http www digitalcommerce com ina versus goliath guess
185,0,http slate com human interest flight attendant interview flying right covid html
186,0,http www huckmag com art culture photography charlie kwai pate en croute sandwich magazine
187,0,http www newstatesman com culture art design news picture best current affair shot
191,0,http briefingday com n commentform
193,0,http www reddit com r nextfuckinglevel comment hct tz fitness freak simultaneously solves rubiks
195,0,http en wikipedia org wiki ill
196,0,http people com health gym try workout pod allow client exercise without mask amid pandemic
197,0,http www cnn com world soap bubble robotic pollination study scn index html
198,0,http thehustle co sport stadium suddenly full cardboard fan
199,0,http www youtube com watch v ru
200,0,http pitchfork com news beyonce drop new song black parade listen
201,0,http www bbc com news science environment
202,0,http salvationmountain u
203,0,http www youtube com watch v j x c text arrated ohn aters eccentric individualistic
204,0,http en wikipedia org wiki essage ottle
205,0,http en wikipedia org wiki ulinary triangle
206,0,http violenceandreligion com mimetic theory
207,0,http en wikipedia org wiki iolence eace eace esearch
208,0,http www lsu edu hs english file university writing file item pdf
209,0,http en wikipedia org wiki ye rovidence
210,0,http en wikipedia org wiki hri antrum
211,0,http www youtube com watch v l
212,0,http www logoworks com blog bass pale ale brand logo
213,1,http whyisthisinteresting com
214,1,http whyisthisinteresting com subscribe
215,0,http www theguardian com commentisfree jun black life mattered revolt cultural debate hostile establishment
216,0,http tribunemag co uk covid could disaster automation waiting
218,0,http pudding cool travel local
219,0,http www bbc com news uk england wiltshire
220,0,http minnesota cbslocal com legislature adjourns special session issue remain unsolved
221,0,http www reuters com article u usa seattle shooting teenager killed seattle protest zone shooting one wounded id
222,0,http apnews com dd b c e e ae
223,0,http www bbc com news uk england berkshire
224,0,http www reuters com article u wirecard account wirecard ceo exit search missing billion hit dead end asia id
225,0,http www axios com major cruise line suspend trip coronavirus c b af b b c e html
226,0,http www cnbc com u treasury sba disclose name business taking ppp loan html
227,0,http www nature com article z
228,0,http www theverge com apple wwdc io ipados watchos arm mac rumor
229,0,http www mpe mpg de era presskit
230,0,http www bbc com news science environment
231,0,http deadline com regal cinema face mask policy change amc adam aron controversy coronavirus
232,0,http www cbssports com mlb news mlb player vote game season monday rob manfred tweak proposal per report
233,0,http www espn com horse racing story id new york bred tiz law win belmont stake
234,0,http www reuters com article u people malala sleep netflix ahead malala finish oxford degree id
235,0,http www documentcloud org document arr etter erman html
236,0,http www judiciary senate gov press rep release chairman graham statement trump administration intent nominate jay clayton u attorney southern district new york
237,0,http www cbsnews com news geoffrey berman trump appointee u attorney william barr
238,0,http www axios com barr trump southern district new york ad bb c aa c c html
239,0,http www scmp com news hong kong politics article national security law beijing plan appoint adviser
240,0,http www reuters com article u hongkong protest finance explainer explainer important hong kong china free finance hub id
241,0,http www reuters com article uk hongkong protest security beijing sweeping power hong kong security law id
243,0,http www politico com news takeaway biden trump may fundraising
244,0,http www tulsaworld com news local big moment inside bok center president trump rally article c bcc b cc f c html
245,0,http ftw usatoday com k pop stans spamming explained
246,0,http www politico com news trump tulsa rally ticket hack
247,0,http www politico com gallery trump rally tulsa oklahoma photo
248,0,http www tulsaworld com news trump tulsa president attack china biden others tout u heritage improving economy article efbcae bd bdd f html
250,1,http link theskimm com manage uz oc
251,1,http www theskimm com general disclaimer e eof gi post
252,1,http doc google com form e p dkb z n c k lc pgrydnzd h b h h n fk rw viewform
253,0,http www collectiveaidngo org
254,0,http uprising mn
255,0,http www sakara com page skimm dr
256,0,http get drinkhydrant com skimm june
257,1,http simplisafe com save
258,1,http www theskimm com skimmpicks
259,0,http food com blog picnic perfect dish taste great room temperature
260,0,http www elle com culture movie tv g best summer tv show
261,0,http www latimes com entertainment art music story beyonce black parade juneteenth
263,0,http www nytimes com world europe forbury garden stabbing reading terrorism html
264,0,http www cnn com uk reading terror incident intl gbr index html
265,0,http www cnn com u nascar ban confederate flag spt trnd index html
266,0,http www espn com racing nascar story id nascar say noose found bubba wallace garage talladega
267,0,http www cnn com politics judge john bolton book index html
268,0,http thehill com homenews administration former manhattan prosecutor condemn berman firing
269,0,http www theguardian com u news jun u attorney geoffrey berman oversaw prosecution trump ally abruptly resigns
270,0,http www nytimes com nyregion trump geoffrey berman fired sdny html
271,0,http apnews com b efe f ae f b c
272,0,http www forbes com site andrewsolender trump campaign manager say registered ticket tulsa rallybut venue seat c e
273,0,http www marketwatch com story trump tongue cheek said u slow testing white house adviser peter navarro say
274,0,http www npr org section health shot younger adult increasingly testing positive coronavirus
275,0,http www insider com texas governor blame coronavirus case spike young people
276,0,http www cnn com u u coronavirus sunday index html
277,1,http stevebryant substack com
278,0,http www outsideonline com world change chart
279,0,http www lawfareblog com challenge effective counterterrorism intelligence
280,0,http www newstatesman com politics health dark side wellness industry
281,0,http e yale edu feature global regulator selling world largest tuna
282,0,http www militarytimes com news military tinder sailor hooker pimp u navy sex trafficking scandal bahrain
283,0,http onezero medium com segway inventor new project manufacturing human organ da c f
284,0,http www thedailybeast com google co founder sergey brin secret disaster relief squad
285,0,http www youtube com watch v ip xxxqw w ref briefingday com curator briefingday com utm source briefingday com utm medium email
286,0,http www layohn com village built among rock html
287,0,http story californiasunday com small business covid north light
288,0,http www nybooks com article college worth
289,0,http www robert goetzfried com
290,0,http redd mzrpdbygb jpg
291,0,http www bbc com future article better predicting future think
292,0,http www popularmechanics com culture gaming lego bionicle faber
293,0,http googlemapsmania blogspot com lived house html
294,0,http www ankit fyi alone
295,0,http www youtube com watch v jedph e ref briefingday com curator briefingday com utm source briefingday com utm medium email
296,0,http www noemamag com statue limitation
297,0,http www inverse com mind body first stay home dad
298,0,http www mcsweeneys net article dad america explained pant
299,0,http theracquet substack com p modernisation tennis
301,0,http briefingday com n commentform
305,0,http www rentalcarrally com
306,0,http arbesman substack com p revisiting world simulation
307,0,http uncertaintymindset substack com p preference uncertainty
308,0,http mailchi mp cba b e f racial capitalism stack green new deal finding right simplifier
309,1,http drawinglinks substack com
310,0,http breakingsmart substack com
311,0,http othervalleys substack com
312,0,http themargins substack com
313,0,http www messynessychic com
314,0,http www youtube com watch v ua rgo
315,0,http apps apple com u app oblique strategy se id
316,0,http www amazon com dp
317,0,http en wikipedia org wiki lab ity alifornia
318,0,http abcnews go com state set record high covid case story
319,0,http www theguardian com world jun coronavirus world map country covid case death
320,0,http apnews com ec b e b c e e
321,0,http www npr org section health shot map tracking spread coronavirus u
322,0,http www nytimes com world coronavirus live update html link bcc
323,1,http www theskimm com invite v new
324,1,http www theskimm com daily skimm
325,1,http www theskimm com
337,0,http www morningbrew com daily story week review crossword june
338,0,http dcist com story past present potential future c statehood explained
339,0,http oversight house gov site democrat oversight house gov file ayor owser estimony pdf
340,0,http www cato org publication commentary dc statehood fool errand
341,0,http www vox com dc statehood new columbia
342,0,http wamu org story c statehood back table here need know push become st state
343,0,http www politico com news house vote dc statehood
344,0,http www geoguessr com
345,0,http www nerdfitness com blog beginner body weight workout burn fat build muscle
346,0,http www nytimes com u wild bus removed html
347,0,http www imdb com title tt
348,0,http www penguinrandomhouse com book wild jon krakauer
349,0,http podcasts apple com u podcast megatrends way think long term downturn id
350,0,http blog ap org announcement decision capitalize black
351,0,http www ft com content f c f c e f f
352,0,http www reuters com article u american airline offering american airline sell share debt cope coronavirus hit id
353,0,http www cnn com tech north face facebook ad index html
354,0,http www reuters com article u usa stock weekahead wall street week ahead london index reshuffle give healthcare stock bigger profile id
355,0,http www forbes com site lisakocay electric blockaloo livestream music festival minecraft
356,0,http www morningbrew com daily story week ahead june
357,0,http www wsj com article new york city reopens driving becomes tempting commute
358,0,http www wsj com article new yorkers return office staying away
359,0,http www morningbrew com daily story nyc enters phase two reopening
360,0,http www youtube com watch v j f go
361,0,http www wsj com article short seller made billion wirecards plunge without scar
362,0,http www nytimes com business wirecard scandal html
363,0,http www morningbrew com daily story whats happening wirecard
364,0,http www npr org geoffrey berman u attorney prosecuted trump ally say wont quit
365,0,http www morningbrew com daily story top sdny prosecutor resigns trump sec chairman nominated take
366,0,http developer apple com
367,0,http apnews com f b b e e aa fb b
369,0,http www theverge com apple hey email app basecamp rejection response controversy antitrust regulation
370,0,http www morningbrew com daily story apple wwdc go virtual first time ever
373,1,http www blackrock com u individual
374,1,http www morningbrew com daily story
375,0,http www morningbrew com daily
377,0,http www itsmestevebryant com
381,0,http briefingday com n commentform
383,0,http www rollingstone com music music feature penny lane beatles slave trade
384,0,http www airspacemag com history flight first air force one
385,0,http www nbcnews com think opinion bullet journal paper planner rage ncna
386,0,http www vice com en u article n wemm strip club forced get creative reopen amid coronavirus
387,0,http www youtube com watch v xug oxg ref briefingday com curator briefingday com utm source briefingday com utm medium email
388,0,http www youtube com watch v exc ref briefingday com curator briefingday com utm source briefingday com utm medium email
389,0,http www youtube com watch v p ik c ref briefingday com curator briefingday com utm source briefingday com utm medium email
390,0,http www protocol com apple wwdc developer
391,0,http seth blog whats front line
392,0,http www npr org section coronavirus live update barcelona opera reopens audience plant
393,0,http www wired com story human ipo startup investing people
394,0,http www theguardian com money jun martin lewis money happiness money destroys life
396,0,http getpocket com explore item meat paradox reveals moral decision making
397,0,http percentinvisible org article insert coin lump coal brief year history vending machine
398,0,http www theguardian com artanddesign gallery sep brief history protest art whitney new york
399,0,http www discovermagazine com health sometimes virus good health
400,0,http melmagazine com en u story everything wikihow
401,0,http theconversation com journalist believe news opinion separate reader cant tell difference
402,0,http www vox com science health optical illusion science humility reality polarization
403,0,http fivethirtyeight com feature police reform fundamentally flawed idea
404,0,http apnews com c f dcd c cb e e
405,0,http www noemamag com long shadow future
406,0,http www brookings edu multi chapter report opioid crisis america domestic international dimension
407,0,http www salon com inside blue leak trove hacked police document released anonymous
408,0,http thewalrus ca shopping mall might coming back
411,0,http oldfashioned tech
412,0,http www youtube com watch v ka ly il w
413,0,http www bbc com news world u canada
414,0,http www dupont com product dupont tychem fr rf sv html
415,0,http www tacobell com food specialty chalupa supreme
416,0,http www cdc gov coronavirus ncov traveler travel u html
417,0,http tinyletter com transportation
418,1,http whyisthisinteresting substack com p interesting autopilot
420,0,http www insidehook com daily brief sex dating woman dont date men cat
421,0,http www vox com good firework complaint northeastern city
422,0,http www tiqets com blog black history museum
423,0,http flowingdata com age generation population
424,0,http www thisiscolossal com joerg daiber flower power
