,is_spam,url_pre
1814,0,http www pix com news local news chase investigating report missing additional money bank account
1815,0,http www radpowerbikes com
1817,0,http www espn com nfl story id grading cam newton move patriot little risk huge potential new look patriot offense
1818,0,http variety com film box office mulan release postponed coronavirus disney
1819,0,http www beyonce com
1820,0,http www cbsnews com news starbucks karen barista san diego dollar tip mask encounter
1825,0,http www morningbrew com daily
1828,0,http www morningbrew com daily story ultimate guide investing today tomorrow beyond story
1829,1,http www morningbrew com marketing
1830,0,http www aljazeera com indepth interactive infographic million coronavirus case html
1832,0,http apnews com ac fd ad aa b fd
1833,0,http www morningbrew com daily story controversy mask threatens u pandemic response
1834,0,http www axios com pelosi face mask coronavirus dc ae b e ad bb b b df html
1835,0,http www courier journal com story news politics mitch mcconnell urge people wear mask there covid vaccine
1836,0,http www cnn com politics joe biden mask mandatory coronavirus index html
1837,0,http www wsj com article transcript president trump interview wall street journal
1838,0,http thehill com homenews sunday talk show penny want defer local official requiring mask
1839,0,http www cnbc com coronavirus mask mandate differ across country hot spot multiply html
1840,0,http www texastribune org face mask order dallas harris travis bexar
1841,0,http www axios com coronavirus face mask science e df b e fb b cf html
1842,0,http www usatoday com story money mask requirement trader joes viral twitter video
1843,0,http www nytimes com u american airline mask brandon straka html
1844,0,http www wsj com article mask could help stop coronavirus still controversial
1845,0,http www morningbrew com daily story mask prove puzzling new retail category
1846,0,http www morningbrew com daily story boeing max expected begin critical test flight monday
1847,0,http www bbc com news business
1848,0,http www nytimes com business boeing max cost html
1850,0,http www morningbrew com daily story chesapeake energy file chapter bankruptcy
1851,0,http www wsj com article fracking trailblazer chesapeake energy file bankruptcy
1852,0,http www nytimes com business economy chesapeake energy bankruptcy html
1854,0,http www morningbrew com daily story ultimate guide investing today tomorrow beyond
1855,0,http www morningbrew com daily story starbucks pause ad social medium
1856,0,http www usatoday com story money facebook ad boycott starbucks pausing advertising social medium platform
1858,0,http www cnn com tech facebook boycott index html
1859,0,http www morningbrew com daily story week ahead june
1860,0,http www npr org section live update protest racial justice trump retweets video apparent supporter saying white power
1861,0,http apnews com b ccef f cf
1862,0,http www reuters com article u usa fed bond big tobacco big oil buffett join fed portfolio id
1863,0,http www espn com nfl story id qb cam newton reach year deal patriot source say
1864,1,http www masterworks io
1867,0,http www miltonglaser com work
1869,1,http www masterworks io disclaimer
1870,0,http www bankingdive com news fed suspend share buyback cap dividend
1871,0,http www vox com stock buyback coronavirus bailouts airline trump
1872,0,http www investopedia com article asp
1873,0,http www youtube com watch v yvkbw w utm source morning brew
1874,0,http www cnbc com populism worked buyback bull market without last html
1875,0,http www youtube com watch v c buz g utm source morning brew
1876,0,http www washingtonexaminer com opinion coronavirus bailout dont punish company stock buyback
1877,0,http www morningbrew com daily story practice selling buyback come fire
1878,0,http www morningbrew com daily story week review crossword june
1891,0,http www statnews com feature coronavirus covid tracker
1892,0,http www bbc com news world u canada
1896,0,http briefingday com n commentform
1898,0,http www abc net au news science home affair protection visa use facebook social medium
1899,0,http edition cnn com travel article cheddar cheese history index html
1900,0,http unherd com thepost stranded seafarer could trigger national food crisis
1901,0,http www nytimes com opinion sunday u coronavirus html
1902,0,http deathbytoys storenvy com product male ego action figure broken
1903,0,http www psychologytoday com u blog living single phony spending time alone authentic people
1904,0,http arstechnica com gadget tiktok io apps still snoop sensitive clipboard data
1905,0,http www bbc com worklife article could adding new public holiday boost economy
1906,0,http www wallpaper com art memoriam milton glaser obituary
1907,0,http www theringer com music top album rick rubin extended universe ranked
1908,0,http melmagazine com en u story waterloo brought abba world didnt know
1909,0,http www telegraph co uk health fitness mind meet family could hold key understanding major mental illness
1910,0,http www reddit com r sk eddit comment hhq dy job lot le fun people
1911,0,http mondaynote com next car electric c fe
1912,0,http www currentaffairs org collecting book
1913,0,http benjaminreinhardt com wddw
1914,0,http www wired co uk article fbi forensic photo
1915,0,http mymodernmet com best milky way photo
1916,0,http www theguardian com world jun new poor covid fuel rising poverty italy
1917,0,http theweek com article election day nightmare scenario
1918,0,http www forbes com site kerryadolan billionaire behind movie contagion working stop pandemic next one
1919,0,http www popularmechanics com technology infrastructure future airport tech coronavirus
1920,0,http theneutral com russia u accuse election meddling
1921,0,http briefingday com n
1924,0,http www legacy com obituary nytimes obituary aspx
1925,0,http en wikipedia org wiki hristopher ry
1926,0,http en wikipedia org wiki ady ot urning
1927,1,http whyisthisinteresting substack com p interesting masked
1928,0,http www paprikaapp com
1932,0,http get drinkhydrant com skimm june
1934,0,http www cookinglight com cooking technique grill anything
1935,0,http yourparade com page
1936,1,http www theskimm com pick beach product make next trip success j n kxs da
1938,0,http www eonline com news beyonc eacute accepts bet award humanitarian award none michelle obama
1940,0,http www cnn com politics mississippi flag confederate emblem index html
1941,0,http apnews com ddde eeae
1942,0,http www theguardian com world jun poland election duda forced second round exit poll suggests
1943,0,http www axios com tim scott trump tweet white power ffa fed b c e cd f c html
1945,0,http www nytimes com u confederate statue photo html
1946,0,http www cbsnews com news trump executive order protect monument
1947,0,http www politico com news g trump russia
1948,0,http www cnet com news russia targeted election system state senate report say
1949,0,http www britannica com event oviet invasion fghanistan
1950,0,http www forbes com site andrewsolender lawmaker party demand answer trump russian bounty de
1951,0,http www wsj com article trump say wasnt aware russia bounty allegation
1952,0,http www reuters com article u mideast crisis syria russia casualtie russian toll syria battle killed wounded source id
1953,0,http www nytimes com u politics russia afghanistan bounty html
1954,0,http people com music adele tell fan patient new album
1957,0,http www cidrap umn edu news perspective covid case among u young adult spike
1958,0,http www livescience com covid coronavirus deadly people html
1960,0,http www usatoday com story tech facebook ad boycott hate speech biggest brand verizon coca cola
1961,0,http www adweek com programmatic civil right group facebook advertiser boycott stophateforprofit
1962,0,http www marketwatch com story facebook share drop unilever halt advertising prompting change social networking giant
1963,0,http www consumerreports org social medium facebook approved ad coronavirus misinformation
1964,0,http www clarionledger com story news politics mississippi state flag lawmaker vote state law remove confederate emblem
1965,0,http www masslive com sport college football v mississippi flag ole miss lane kiffin msu mike leach call drop confederate emblem state flag html
1966,0,http mshistorynow mdah state m u article flag mississippi
1967,0,http www clarionledger com story news stennis flag thing know popular replacement choice
1969,0,http www vox com coronavirus pandemic black life matter protest
1970,0,http www vox com elijah mcclain george floyd black life matter protest killing
1971,0,http www nytimes com book review neel patel see dont say hi html
1972,0,http www bookdepository com ove olour olu abalola
1973,0,http www nytimes com book review windfall diksha basu html
1974,0,http www vox com policy politics bill barr donald trump berman doj david rohde
1975,0,http www vox com united state serbia democracy journalist stevan dojcinovic
1976,0,http www nytimes com book review interior chinatown charles yu html
1977,0,http www penguinrandomhouse com book burning megha majumdar
1978,0,http www penguinrandomhouse com book vanishing half brit bennett
1979,0,http www penguinrandomhouse com book nobody tell be kalb
1980,0,http www theguardian com book apr naoise dolan im good presenting likable
1981,0,http www penguinrandomhouse com book possessed elif batuman
1982,0,http www storypirates com podcast
1983,0,http podcasts apple com u podcast ghost podcast id
1984,0,http www estherperel com podcast
1985,0,http www mydadwroteaporno com
1986,0,http podcasts apple com u podcast guilty feminist id
1987,0,http podcasts apple com u podcast jesus jollof id
1988,0,http podcasts apple com u podcast ask ronna id
1989,0,http shesallfatpod com podcast
1990,0,http homecooking show
1991,0,http songexploder net
1992,0,http www callyourgirlfriend com episode
1993,0,http littleeverywhere com show
1994,0,http theweekjunior com
1995,0,http www thejuggernaut com newsletter
1996,0,http emilyoster substack com
1997,0,http www nytimes com newsletter parenting
1998,0,http www latimes com newsletter coronavirus today
1999,0,http hotpodnews com
2000,0,http www vox com eviction moratorium senate bill elizabeth warren chuy garcia
2001,0,http open spotify com episode dcb h
2002,0,http www vox com recode amazon coronavirus warehouse worker protest jeff bezos chris small boycott pandemic
2004,0,http www nytimes com world asia afghanistan woman human right html
2005,0,http www politico com news sun belt coronavirus trump reelection
2007,0,http www vox com coronavirus pandemic second wave u america
2008,0,http www nytimes com u coronavirus hospital houston html
2010,0,http www nbcnews com news world global covid case reach million john hopkins data n
2011,0,http www reuters com article u health coronavirus case global coronavirus case exceed million id
2012,0,http www cnn com world coronavirus death toll case intl index html
2014,0,http rollcall com supreme court allows president fire head consumer protection agency
2015,0,http www nytimes com u politics cfpb supreme court html
2016,0,http www vox com supreme court abortion chief justice john robert stephen breyer june medical russo
2017,0,http www npr org supreme court hand abortion right victory louisiana case
2018,0,http www thecut com supreme court vote block louisiana abortion law html
2019,0,http www latimes com politics story supreme court louisiana abortion case
2020,0,http abcnews go com olitics supreme court hand major decision louisiana abortion case story
2022,1,http janefriedman u list manage com profile
2023,1,http janefriedman u list manage com unsubscribe
2024,0,http buffer com
2025,1,http u campaign archive com
2026,1,http courtneymaum u list manage com subscribe
2027,0,http blackcardiganedit com category newsletter
2028,0,http www npr org section live update protest racial justice princeton remove woodrow wilson name public policy school
2029,0,http offer kettleandfire com june
2030,0,http bleacherreport com article report cam newton patriot agree year incentive laden contract
2031,0,http www billboard com article news milton glaser designer love ny logo bob dylan silhouette poster dy
2032,0,http ew com book graduate author charles webb dy
2033,0,http www hollywoodreporter com list daytime emmy award winner full list
2034,0,http mailchi mp bigspaceship big spaceship internet brunch
2035,0,http www youtube com watch v k feature youtu utm source nternet runch utm campaign acebbd c utm medium email utm term fb e aa acebbd c mc cid acebbd c mc eid
2036,0,http mashable com article twitter meme know spot place
2037,0,http junkee com shredded cheese wife guy
2038,0,http www vulture com hood baby shuffle tiktok trend kbfr explained html
2039,0,http deadline com mulan release date change august
2041,0,http variety com digital news princess bride remake quibi joe jonas sophie turner tiffany haddish
2042,0,http www youtube com watch v aa nh w feature youtu utm source nternet runch utm campaign acebbd c utm medium email utm term fb e aa acebbd c mc cid acebbd c mc eid
2043,0,http www youtube com watch v x kz h c feature youtu utm source nternet runch utm campaign acebbd c utm medium email utm term fb e aa acebbd c mc cid acebbd c mc eid
2044,0,http ew com tv ava duvernay colin kaepernick netflix series
2045,0,http www youtube com watch v j jrx ux feature youtu utm source nternet runch utm campaign acebbd c utm medium email utm term fb e aa acebbd c mc cid acebbd c mc eid
2046,0,http www youtube com watch v r em feature youtu utm source nternet runch utm campaign acebbd c utm medium email utm term fb e aa acebbd c mc cid acebbd c mc eid
2047,0,http variety com music news chase rice concert crowd packed video social distancing
2048,0,http variety com tv news bachelorette set resume production exclusive
2049,0,http www cosmopolitan com lifestyle jenna marble quitting youtube blackface nicki minaj apology
2050,0,http adage com article digital continually updated list brand joining facebook ad boycott
2052,0,http www theverge com twitch sexual harassment assault permanent ban streamer
2053,0,http techcrunch com facebook old content notification screen
2054,0,http techcrunch com youtubes latest experiment tiktok rival focused second video
2055,0,http www theverge com amazon seattle nhl climate pledge arena environment
2056,0,http www nytimes com u supreme court abortion louisiana html
2057,0,http www fastcompany com aocs brand groundbreaking inspiring knockoff around world
2058,0,http www npr org section live update protest racial justice nasa name headquarters mary jackson first black female engineer
2064,0,http www lelo com bestseller
2065,0,http melmagazine com en u story man female orgasm doctor
2066,0,http www theringer com music rick rubin producer legacy def jam shangri la
2067,0,http www politico com news magazine republican convention florida donald trump
2068,0,http www popsci com story science number look like spaghetti
2070,0,http www newyorker com science medical dispatch coronavirus surge texas could seen coming
2071,0,http www cnbc com chart show link restaurant spending new coronavirus case html
2072,0,http www thedailybeast com mexico reopening go
2073,0,http digg com video cow love cow brush
2074,0,http www nytimes com world coronavirus update html
2075,0,http www msn com en u news u black officer detained george floyd pledged fix police ar
2076,0,http www politico com news trump share video supporter yell white power
2077,0,http huckberry com store truff category p black truffle infused hot sauce set
2078,0,http www dmagazine com publication magazine january beverly jean hope murder grover hope new suspect
2079,0,http www bbc com travel story unlikely home world smallest desert
2080,0,http digg com edition top story
2084,0,http digg cmail com u pthulty vkjjhbly dr
2086,0,http moralcode com product quintus
2087,0,http www gq com story ego free guide making partner come
2088,0,http huckberry com journal post best brewery state
2089,0,http www mentalfloss com article best song movie
2092,0,http curiositystream com hustle
2093,0,http www wsj com article amazon acquire self driving startup zoox
2094,0,http thehustle co waymo driverless car alphabet
2095,0,http www nytimes com business amazon zoox html
2096,0,http www wired com story amazon aurora self driving investment funding series b
2097,0,http thehustle co amazon drone delivery
2098,0,http www wired com story amazon shake self driving ride hailing
2099,0,http thehustle co mazon vehicle
2100,0,http story starbucks com story creating welcoming inclusive online community
2101,0,http level medium com guide upgrading sex position cb e
2102,0,http melmagazine com en u story america lost way switched porno porn
2103,0,http www insidehook com feature art interview mark seliger iconic celebrity photograph
2104,0,http www mensjournal com food drink loved sandwich america
2105,0,http melmagazine com en u story quarantine revved back wholesome tradition car sex
2106,0,http www theringer com porn coronavirus pandemic onlyfans
2107,0,http www demilked com creepy scary nature
2108,0,http melmagazine com en u story five lie youve told whiskey
2109,1,http elv fnd crownes
2110,0,http greatist com grow libido concern treatment
2120,0,http www wsj com article shift plan go public year covid boost online car sale
2121,0,http www cnbc com tock market future open close news html
2122,0,http www reuters com article u usa stock wall street end higher boeing bump stimulus eyed id
2123,0,http www cnbc com coronavirus update pending home sale spike record point percent may html
2126,0,http www doordash com
2127,0,http www reddit com r dataisbeautiful
2128,0,http www nytimes com movie sundance virus html
2129,0,http www nytimes com u fake face mask exemption card coronavirus html
2130,0,http www bbc com news business
2131,0,http www nytimes com technology working home failure html
2132,0,http www nytimes com theater broadway reopening coronavirus html
2133,0,http www theverge com twitch donald trump ban campaign account
2134,0,http www theverge com reddit ban subreddits donald chapo trap house new content policy rule
2135,0,http techcrunch com india ban tiktok dozen chinese apps
2136,0,http www nytimes com technology uber postmates buy offer html
2137,0,http thehustle co lululemon self care product lifestyle brand
2138,0,http www nytimes com business lululemon buy mirror html
2139,0,http www businesswire com news home en lululemon athletica cquire ome itness nnovator
2140,0,http thehustle co wift training
2141,0,http www fastcompany com bike racing go virtual captivate cycling billion fan worldwide
2142,0,http www zwift com welcome zwift
2143,0,http thehustle co foraging mushroom
2144,0,http www newyorker com magazine foraged food shorten supply chain
2145,0,http thehustle co recruiting referral
2146,0,http onezero medium com tech elite selling job referral facebook google amazon f afdd
2147,0,http thehustle co oupang ecommerce
2149,0,http www reuters com article u health coronavirus southkorea explain explainer catch covid delivered package id
2150,0,http www cnbc com meet cnbc disruptor company html
2151,0,http www cnbc com coupang crushed amazon become south korea biggest online retailer html
2153,0,http www washingtonpost com term service g ldi story html
2154,0,http www washingtonpost com privacy policy g iai story html
2155,1,http helpcenter washingtonpost com hc en u
2156,1,http subscribe washingtonpost com newsletter
2157,1,http subscribe washingtonpost com newsletter newsletter
2158,1,http subscribe washingtonpost com newsletter bundle boldschool wapo
2159,1,http subscribe washingtonpost com newsletter bundle hax wapo
2160,1,http subscribe washingtonpost com newsletter bundle comment wapo
2162,1,http www joinhoney com page implified ellow eneral
2163,0,http www nytimes com nyregion coronavirus fusco family nj html
2164,0,http newrepublic com article democrat cant quit addiction big money donor
2165,0,http www buzzfeednews com article amberjamieson coronavirus social distancing contract divorce parent
2166,0,http www vox com trump obamacare repeal short term health care insurance scam
2167,0,http narratively com conscripted emperor private orchestra
2168,0,http www vice com en u article dv map show u home flood next year due climate change
2169,0,http www propublica org article north carolina transformed worst state unemployed
2170,0,http slate com technology george orwell black life matter police colonialism html
2171,0,http digg com video cant drive north south america
2172,0,http www reuters com article u usa auto fleet sale analysis slumping fleet sale weigh u auto market id
2173,0,http www nbcnews com news u news state halt reopening bar indoor dining public health expert urge n
2174,0,http apnews com fcf ec c f b da b
2175,0,http store digg com sale apple magic mouse wireless rechargable silver certified refurbished
2176,0,http www outsideonline com death el cap
2177,0,http www gq com story spy uber driver
2178,0,http digg com edition top story
2182,0,http digg cmail com u ptkulky vkjjhbly dl
2194,0,http morningbrewdaily typeform com ppx w
2195,0,http www morningbrew com daily story second half preview
2197,0,http techcrunch com u e commerce sale jump april led online grocery
2198,0,http www morningbrew com daily story future city
2199,1,http www morningbrew com daily story virtual world stay
2200,0,http www morningbrew com daily story higher ed never
2201,0,http www morningbrew com daily story remote work destiny
2202,0,http www morningbrew com daily story thing sped covid
2203,0,http www morningbrew com daily story photo
2204,0,http www morningbrew com daily story spacex successfully launch human space
2205,0,http www nytimes com business economy trump navarro china trade deal html
2206,0,http www foodandwine com news san francisco district attorney sue doordash
2207,0,http www economist com business end sight samsungs legal trouble
2208,0,http www axios com tech summer antitrust cffcc afc f b html
2209,0,http www morningbrew com daily story underreported business story
2210,0,http www usatoday com story tech twitter ceo jack dorsey elliott management
2211,0,http apnews com c aab b f
2212,0,http www nytimes com technology twitter trump dorsey html
2213,0,http www nytimes com opinion sunday twitter protest politics html
2214,0,http www cnbc com twitter ceo jack dorsey san francisco comment warning sign html
2215,0,http www morningbrew com daily story tale three crisis twitter fared h
2216,0,http www wsj com news noted
2217,0,http cloudwars co covid zoom quarter eye popping stats tech new superstar
2218,0,http www brynjolfsson com remotework
2219,0,http www theguardian com film mar u box office drop year year wednesday reach historic low
2220,0,http www pcmag com news u netflix subscriber watch hour use gb data per day
2221,0,http str com press release u hotel demand expected fully recover
2222,0,http www businessinsider com air traffic coronavirus pandemic change effect around world continuation commercial flight u mask people flying
2223,0,http fortune com black ceo fortune african american business leader
2224,0,http www creosotemaps com blm
2225,1,http coronavirus jhu edu map html
2226,0,http www marketwatch com story another million new jobless claim predicted arent falling faster
2227,0,http www morningbrew com daily story h number
2228,0,http www morningbrew com emerging tech story microsoft amazon announce restriction facial recognition sale police department html
2229,0,http www morningbrew com daily story aunt jemima uncle ben owner rethink offensive brand
2230,0,http www reuters com article u minneapolis police bank america bank america pledge billion address racial economic inequality id
2231,0,http www morningbrew com daily story corporate america finally say black life matter
2232,0,http www politico com news magazine coronavirus shutdown kill switch
2233,0,http www wsj com article amazon keep job added pandemic
2234,0,http www npr org congress approved trillion coronavirus relief far here breakdown
2235,0,http www nytimes com business imf world economic outlook html
2236,0,http www ilo org global ilo newsroom news lang en index htm
2237,0,http www youtube com watch v zw
2238,0,http www morningbrew com daily story reflecting h historic economic shutdown
2241,0,http www morningbrew com daily latest
2243,0,http www washingtonpost com world asia pacific hong kong national security law end freedom democracy china c e ba b ea c cf ffe c story html
2244,0,http www washingtonpost com national security russian bounty taliban linked militant resulted death u troop according intelligence assessment ffaec b ea b ece dc story html
2249,0,http www vox com policy politics voxcare remdesivir price coronavirus
2250,0,http www vox com recode blockbuster netflix podcast land giant
2251,0,http www vox com energy environment aoc climate change house democrat select committee report
2252,0,http www vox com bipoc mean critical race linguistics jonathan rosa deandra mile hercules
2253,0,http www vox com news update vox google assistant
2254,0,http www youtube com watch v u
2255,0,http apnews com b de af e c f c
2257,0,http www vox com trump system failure
2258,0,http www nytimes com style boogaloo hawaiian shirt html
2259,0,http www npr org section coronavirus live update eu set new list approved travel partner u isnt
2260,0,http www vox com supreme court separation church state espinoza montana school religion
2261,0,http www courier journal com story news politics election kentucky kentucky u senate primary election result booker v mcgrath
2262,0,http www vox com live result june primary colorado utah oklahoma
2263,0,http www scmp com news hong kong politics article hong kong activist plan defy police ban july protest
2264,0,http www nytimes com world asia china hong kong security law rule html
